{
  "$schema": "https://json-schema.org/draft/2020-12/schema",
  "title": "Agentic Phase State",
  "type": "object",
  "required": ["schemaVersion", "lastUpdated", "currentPhase", "phases"],
  "properties": {
    "schemaVersion": { "const": 1 },
    "lastUpdated": { "type": "string" },
    "sourceNote": { "type": "string" },
    "currentPhase": { "type": "string" },
    "phases": {
      "type": "object",
      "additionalProperties": {
        "type": "object",
        "required": ["status"],
        "properties": {
          "status": {
            "enum": ["queued", "planning", "planned", "implementing", "implemented", "rechecking", "validating", "pr_open", "checks_pending", "merged", "cleaned_up", "complete", "blocked", "failed"]
          },
          "branch": { "type": "string" },
          "pr": { "type": "integer" },
          "mergeCommit": { "type": "string" },
          "evidenceDir": { "type": "string" },
          "reason": { "type": "string" }
        }
      }
    }
  }
}
