{
  "currentPhase": "PHASE-04A",
  "lastUpdated": "2026-06-01",
  "phases": {
    "PHASE-00B": {
      "branch": "main",
      "evidenceDir": "runs/phase-runner/PHASE-00B/2026-05-31T14:18:34Z",
      "status": "complete"
    },
    "PHASE-01A": {
      "branch": "phase/phase-01a-microgpt-character-lm",
      "evidenceDir": "runs/phase-runner/PHASE-01A/2026-05-31T16:09:24Z",
      "mergeCommit": "464c3342d3adb9e115e27c068dc513147a7af091",
      "pr": 1,
      "status": "complete"
    },
    "PHASE-02A": {
      "branch": "phase/phase-02a-tokenizer-data-pipeline",
      "evidenceDir": "runs/phase-runner/PHASE-02A/2026-05-31T16:41:04Z",
      "mergeCommit": "a1295e568294980f11dff5d7590ce5890d1b9d24",
      "pr": 2,
      "status": "complete"
    },
    "PHASE-03A": {
      "branch": "phase/phase-03a-core-transformer",
      "evidenceDir": "runs/phase-runner/PHASE-03A/2026-05-31T17:12:39Z",
      "mergeCommit": "d672096c7ebdbee1e09bf85431380e5105a4b9bc",
      "pr": 3,
      "status": "complete"
    },
    "PHASE-04A": {
      "status": "queued"
    },
    "PHASE-05A": {
      "status": "queued"
    },
    "PHASE-06A": {
      "status": "queued"
    },
    "PHASE-07A": {
      "status": "queued"
    },
    "PHASE-08A": {
      "status": "queued"
    },
    "PHASE-09A": {
      "status": "queued"
    }
  },
  "schemaVersion": 1,
  "sourceNote": "Configured from docs/NORTH_STAR_LLM_FROM_SCRATCH_MAC.md."
}
